{
  "schema_version": "9.0.0",
  "policy_version": "9.0.0",
  "calibrated_at": "2026-09-25T06:37:14Z",
  "status": "VALID",
  "provenance_hashes": {
    "context_policy_hash": "719d076c63ac09dc268395e68f00acbf692907b8004183d85cd6cb9f94bf2358",
    "toolchain_lock_hash": "c4308ef5bbd799ece57ac0751d04eab4b47d88f2bf5c144cfa45c2a2bb9502f4",
    "harness_profiles_hash": "ee81f04e5f0ccac2ca5d795bc5b010969dc1accee284597b3207f4ee75459f68",
    "calibration_evidence_hash": "6ab21b8c6cd2076e253e091b9588a3df432608586a26d7f51dd84c5a53214780"
  },
  "model_ladders": {
    "gemini-3.8-flash": [
      "low",
      "medium",
      "high"
    ],
    "claude-sonnet-4-6": [
      "high"
    ],
    "qwen3.8-max": [
      "low",
      "medium",
      "xhigh"
    ],
    "gpt-5.6-luna": [
      "low",
      "medium",
      "high",
      "xhigh"
    ],
    "claude-sonnet-5": [
      "low",
      "medium",
      "high",
      "xhigh",
      "max"
    ],
    "openrouter/openrouter/free": [
      "free"
    ]
  },
  "role_policy": {
    "planner": {
      "initial_effort": "medium",
      "escalation_ceiling": "high",
      "preferred_profile": "agy-spec-medium"
    },
    "plan_reviewer": {
      "initial_effort": "medium",
      "escalation_ceiling": "high",
      "preferred_profile": "agy-spec-medium"
    },
    "worker": {
      "initial_effort_by_class": {
        "routine": "low",
        "standard": "medium",
        "deep": "high"
      },
      "escalation_ceiling_by_class": {
        "routine": "medium",
        "standard": "high",
        "deep": "high"
      }
    },
    "final_auditor": {
      "initial_effort": "high",
      "escalation_ceiling": "high",
      "preferred_profile": "agy-audit-high"
    },
    "remediation_planner": {
      "initial_effort": "medium",
      "escalation_ceiling": "high",
      "preferred_profile": "agy-spec-medium"
    },
    "remediation_worker": {
      "initial_effort": "high",
      "escalation_ceiling": "high"
    }
  },
  "task_policy": {
    "backend": {
      "default_execution_class": "standard",
      "initial_effort_by_class": {
        "routine": "low",
        "standard": "medium",
        "deep": "high"
      },
      "escalation_ceiling_by_class": {
        "routine": "medium",
        "standard": "high",
        "deep": "high"
      },
      "preferred_profile_by_class": {
        "routine": "agy-backend-low",
        "standard": "agy-backend-medium",
        "deep": "agy-backend-high"
      }
    },
    "frontend": {
      "default_execution_class": "standard",
      "initial_effort_by_class": {
        "routine": "low",
        "standard": "medium",
        "deep": "high"
      },
      "escalation_ceiling_by_class": {
        "routine": "medium",
        "standard": "high",
        "deep": "high"
      },
      "preferred_profile_by_class": {
        "routine": "agy-frontend-low",
        "standard": "agy-frontend-medium",
        "deep": "agy-frontend-high"
      }
    },
    "testing": {
      "default_execution_class": "routine",
      "initial_effort_by_class": {
        "routine": "low",
        "standard": "medium",
        "deep": "high"
      },
      "escalation_ceiling_by_class": {
        "routine": "medium",
        "standard": "high",
        "deep": "high"
      },
      "preferred_profile_by_class": {
        "routine": "agy-tests-low",
        "standard": "agy-tests-medium",
        "deep": "agy-tests-high"
      }
    },
    "mechanical_change": {
      "default_execution_class": "routine",
      "initial_effort_by_class": {
        "routine": "low",
        "standard": "medium",
        "deep": "high"
      },
      "escalation_ceiling_by_class": {
        "routine": "medium",
        "standard": "high",
        "deep": "high"
      }
    },
    "fixture": {
      "default_execution_class": "routine",
      "initial_effort_by_class": {
        "routine": "low",
        "standard": "medium",
        "deep": "high"
      },
      "escalation_ceiling_by_class": {
        "routine": "medium",
        "standard": "high",
        "deep": "high"
      }
    },
    "support": {
      "default_execution_class": "routine",
      "initial_effort_by_class": {
        "routine": "low",
        "standard": "medium",
        "deep": "high"
      },
      "escalation_ceiling_by_class": {
        "routine": "medium",
        "standard": "high",
        "deep": "high"
      }
    },
    "coding": {
      "default_execution_class": "standard",
      "initial_effort_by_class": {
        "routine": "low",
        "standard": "medium",
        "deep": "high"
      },
      "escalation_ceiling_by_class": {
        "routine": "medium",
        "standard": "high",
        "deep": "high"
      }
    },
    "integration": {
      "default_execution_class": "standard",
      "initial_effort_by_class": {
        "routine": "medium",
        "standard": "high",
        "deep": "high"
      },
      "escalation_ceiling_by_class": {
        "routine": "high",
        "standard": "high",
        "deep": "high"
      },
      "preferred_profile_by_class": {
        "routine": "agy-backend-medium",
        "standard": "agy-integration-high",
        "deep": "agy-integration-high"
      }
    },
    "debugging": {
      "default_execution_class": "deep",
      "initial_effort_by_class": {
        "routine": "medium",
        "standard": "high",
        "deep": "high"
      },
      "escalation_ceiling_by_class": {
        "routine": "high",
        "standard": "high",
        "deep": "high"
      }
    },
    "conflict_resolution": {
      "default_execution_class": "deep",
      "initial_effort_by_class": {
        "routine": "high",
        "standard": "high",
        "deep": "high"
      },
      "escalation_ceiling_by_class": {
        "routine": "high",
        "standard": "high",
        "deep": "high"
      }
    },
    "specification": {
      "default_execution_class": "standard",
      "initial_effort_by_class": {
        "routine": "medium",
        "standard": "medium",
        "deep": "high"
      },
      "escalation_ceiling_by_class": {
        "routine": "high",
        "standard": "high",
        "deep": "high"
      },
      "preferred_profile_by_class": {
        "routine": "agy-spec-medium",
        "standard": "agy-spec-medium",
        "deep": "agy-spec-high"
      }
    },
    "review": {
      "default_execution_class": "standard",
      "initial_effort_by_class": {
        "routine": "medium",
        "standard": "medium",
        "deep": "high"
      },
      "escalation_ceiling_by_class": {
        "routine": "high",
        "standard": "high",
        "deep": "high"
      }
    },
    "audit": {
      "default_execution_class": "deep",
      "initial_effort_by_class": {
        "routine": "high",
        "standard": "high",
        "deep": "high"
      },
      "escalation_ceiling_by_class": {
        "routine": "high",
        "standard": "high",
        "deep": "high"
      },
      "preferred_profile_by_class": {
        "routine": "agy-audit-high",
        "standard": "agy-audit-high",
        "deep": "agy-audit-high"
      }
    }
  },
  "escalation_policy": {
    "enabled": true,
    "max_effort_escalations_per_task": 1,
    "eligible_failure_categories": [
      "AUDIT_REQUIRED_REMEDIATION",
      "DETERMINISTIC_TEST_FAILED",
      "INCOMPLETE_RESULT",
      "MISSING_EXPECTED_FILES",
      "PATH_VALIDATION_FAILED",
      "REQUIREMENT_VALIDATION_FAILED",
      "SCHEMA_VIOLATION",
      "WORKER_RESULT_INVALID"
    ],
    "non_eligible_failure_categories": [
      "AUTH_BLOCKED",
      "BINARY_NOT_FOUND",
      "CANCELLED",
      "CONFLICTED",
      "CONTEXT_ANCHOR_MISSING",
      "CONTEXT_BUDGET_EXCEEDED",
      "CONTEXT_COMPILATION_FAILED",
      "CONTEXT_PACKET_STALE",
      "EXECUTABLE_MISSING",
      "GIT_CONFLICT",
      "INVALID_CLI_FLAG",
      "INVALID_MODEL",
      "NETWORK_FAILURE",
      "ORPHAN_DERIVED_REQUIREMENT",
      "PROVIDER_UNAVAILABLE",
      "RATE_LIMIT",
      "TIMED_OUT",
      "TIMEOUT",
      "UNEXPECTED_COMPILATION_ERROR",
      "WORKTREE_FAILURE"
    ],
    "same_model_family_only": true
  },
  "calibration_evidence": {
    "summary": "Calibrated across Fixtures A-F for lowest sufficient reasoning effort satisfying deterministic quality gates.",
    "baseline_ref": "certification/v9/effort-baseline.json",
    "capabilities_ref": "certification/v9/effort-capabilities.json",
    "calibration_runs_ref": "certification/v9/calibration-runs.jsonl",
    "certification_ref": "certification/v9/reasoning-policy-certification.json",
    "calibrated_roles": [
      "worker",
      "planner",
      "plan_reviewer",
      "final_auditor",
      "remediation_planner",
      "remediation_worker"
    ]
  }
}